{
  "$schema": "https://json-schema.org/draft/2020-12/schema",
  "$id": "https://gitpress.net/schemas/v1/gitpress.schema.json",
  "title": "GitPress site configuration (gitpress.json)",
  "description": "Lives at the root of a GitPress data repository. schemaVersion is bumped only for breaking changes; new fields are always additive and optional.",
  "type": "object",
  "required": ["schemaVersion", "site", "theme"],
  "properties": {
    "schemaVersion": {
      "type": "integer",
      "const": 1,
      "description": "Spec version of this file. Builders must refuse versions they do not understand instead of guessing."
    },
    "site": {
      "type": "object",
      "required": ["title"],
      "properties": {
        "title": { "type": "string", "minLength": 1 },
        "description": { "type": "string", "default": "" },
        "language": {
          "type": "string",
          "default": "en",
          "description": "BCP-47 language tag, e.g. en, zh-CN."
        },
        "url": {
          "type": "string",
          "description": "Canonical site URL, e.g. https://alice.github.io/my-blog. Used for sitemap/RSS/absolute links."
        },
        "basePath": {
          "type": "string",
          "default": "/",
          "description": "Path prefix the site is served under (GitHub Pages project sites use /<repo>/)."
        },
        "author": { "type": "string" },
        "timezone": {
          "type": "string",
          "description": "IANA time zone, e.g. Asia/Shanghai. Public pages format dates here; unzoned frontmatter dates are interpreted in this zone at build time."
        },
        "logo": {
          "type": "string",
          "description": "Public path to the site logo, typically /media/logo-….png. Lives on site so it survives theme switches. Themes decide visibility via theme.config.showLogo."
        },
        "avatar": {
          "type": "string",
          "description": "Public path to a circular author/site avatar, typically /media/avatar-….png. Themes decide visibility via theme.config.showAvatar."
        },
        "categories": {
          "type": "array",
          "description": "Ordered, site-owner-maintained categories. Themes render /categories/<slug>/ archive pages for every entry, and top nav links for those with inNav !== false. Distinct from posts' free-form tags — each post picks at most one category from this list.",
          "items": {
            "type": "object",
            "required": ["slug", "label"],
            "properties": {
              "slug": { "type": "string", "minLength": 1 },
              "label": { "type": "string", "minLength": 1 },
              "inNav": {
                "type": "boolean",
                "default": true,
                "description": "When false, omit this category from the generated site's top navigation. Archive pages and post assignment are unaffected. Missing means true."
              }
            },
            "additionalProperties": true
          }
        },
        "postsPerPage": {
          "type": "integer",
          "minimum": 1,
          "default": 10,
          "description": "Posts per page for the homepage and category archives."
        },
        "analyticsSnippet": {
          "type": "string",
          "description": "Raw HTML/script snippet inserted verbatim before </head> on every page. When site.analytics.providers is present, builders compile enabled providers into this field. Empty/absent means no analytics are injected."
        },
        "analytics": {
          "type": "object",
          "description": "Structured analytics providers for the GitPress UI. Themes must ignore this and insert analyticsSnippet only. Disabled providers are kept but not compiled into the published site.",
          "properties": {
            "providers": {
              "type": "array",
              "items": {
                "type": "object",
                "required": ["type"],
                "properties": {
                  "type": {
                    "type": "string",
                    "enum": ["ga4", "clarity", "cloudflare", "baidu", "umami", "51la", "custom"]
                  },
                  "enabled": { "type": "boolean" },
                  "dashboardUrl": {
                    "type": "string",
                    "description": "Optional https URL of the provider dashboard."
                  },
                  "measurementId": { "type": "string" },
                  "projectId": { "type": "string" },
                  "token": { "type": "string" },
                  "siteId": { "type": "string" },
                  "websiteId": { "type": "string" },
                  "src": { "type": "string" },
                  "id": { "type": "string" },
                  "ck": { "type": "string" },
                  "label": { "type": "string" },
                  "html": { "type": "string" }
                },
                "additionalProperties": true
              }
            }
          },
          "additionalProperties": true
        },
        "comments": {
          "type": "object",
          "description": "Site-level comments. enabled is independent of whether giscus is connected — turning it off hides the widget without dropping giscus. When enabled is absent, themes treat comments as on if giscus or commentsSnippet is present.",
          "properties": {
            "enabled": { "type": "boolean" },
            "giscus": {
              "type": "object",
              "required": ["repo", "repoId", "category", "categoryId"],
              "properties": {
                "repo": { "type": "string", "description": "Public site repo, e.g. alice/my-blog." },
                "repoId": { "type": "string", "description": "GitHub GraphQL node id of that repo." },
                "category": { "type": "string" },
                "categoryId": { "type": "string" },
                "mapping": { "type": "string", "const": "pathname" },
                "lang": { "type": "string", "description": "giscus data-lang, derived from site.language." }
              },
              "additionalProperties": true
            }
          },
          "additionalProperties": true
        },
        "commentsSnippet": {
          "type": "string",
          "description": "Legacy raw embed snippet used only when comments.giscus is absent. Empty/absent means no fallback."
        },
        "nav": {
          "type": "array",
          "description": "Explicit, ordered top-nav menu maintained by the site owner. When present, this is the only source of truth for the generated site's navigation (including whether Home/RSS appear at all). When absent, themes fall back to Home + inNav categories + pages; RSS belongs in the footer unless the owner adds it here. Item labels may be overridden; default Home/RSS copy should follow site.language.",
          "items": {
            "type": "object",
            "required": ["type"],
            "properties": {
              "type": { "type": "string", "enum": ["home", "rss", "category", "page", "link"] },
              "slug": {
                "type": "string",
                "description": "Required for type 'category' (matches site.categories[].slug) and type 'page' (matches the page's slug)."
              },
              "url": { "type": "string", "description": "Required for type 'link'. Absolute URL." },
              "label": {
                "type": "string",
                "description": "Display text override. Required for type 'link'; optional for every other type, which otherwise derive a default label (category label, page title, \"Home\", \"RSS\")."
              }
            },
            "additionalProperties": true
          }
        },
        "footer": {
          "type": "array",
          "description": "Explicit footer. When present, themes render exactly these items (then site.beian). When absent, default is copyright + GitPress + theme credit + RSS, all hideable. System types: copyright, gitpress, theme, rss. Custom types are only page, link, text. Unknown types: render as link if url+label, else plain text if label. copyright labels may include {year}. theme has no url here — resolve from the active theme.json homepage.",
          "items": {
            "type": "object",
            "required": ["type"],
            "properties": {
              "type": { "type": "string" },
              "slug": { "type": "string" },
              "url": { "type": "string" },
              "label": { "type": "string" }
            },
            "additionalProperties": true
          }
        },
        "convertUploadsToWebp": {
          "type": "boolean",
          "default": true,
          "description": "Admin-only. When not false, the GitPress UI converts JPEG/PNG to WebP in the browser before writing media/. GIF, SVG, WebP, and AVIF are skipped; conversion failure or a larger result keeps the original file. Themes and builders must ignore this field."
        },
        "beian": {
          "type": "object",
          "description": "Mainland China ICP / public-security filing. Themes append this after footer items when set. Not a footer list entry (cannot be hidden except by clearing the fields).",
          "properties": {
            "icp": {
              "type": "string",
              "description": "MIIT ICP number, e.g. 京ICP备12345678号. Linked to https://beian.miit.gov.cn/"
            },
            "gongan": {
              "type": "string",
              "description": "MPS filing recordcode (digits). Linked to the official query page with a shield icon."
            }
          },
          "additionalProperties": true
        }
      },
      "additionalProperties": true
    },
    "theme": {
      "type": "object",
      "required": ["name", "source"],
      "properties": {
        "name": {
          "type": "string",
          "description": "Theme identifier, e.g. classic or @acme/my-theme."
        },
        "source": {
          "type": "string",
          "description": "Where to fetch the theme. Formats: 'builtin' (resolved from the official GitPress themes monorepo), 'github:<owner>/<repo>[/<subdir>]#<ref>', or 'npm:<package>@<version>'."
        },
        "ref": {
          "type": "string",
          "description": "Pinned version/tag/commit of the theme. Builders must never float to latest implicitly."
        },
        "config": {
          "type": "object",
          "description": "Theme-specific options, validated against the theme's theme.json configSchema.",
          "additionalProperties": true
        }
      },
      "additionalProperties": true
    },
    "build": {
      "type": "object",
      "description": "Build pipeline options.",
      "properties": {
        "includeDrafts": {
          "type": "boolean",
          "default": false,
          "description": "Safety valve for previews. Public builds must keep this false."
        },
        "output": {
          "type": "string",
          "default": "dist",
          "description": "Build output directory inside the theme project."
        }
      },
      "additionalProperties": true
    },
    "plugins": {
      "type": "array",
      "description": "Reserved for the GitPress plugin system (spec v1 does not execute plugins; builders must ignore unknown entries without failing).",
      "items": { "type": "object" }
    }
  },
  "additionalProperties": true
}
